{
  "schemaVersion": "0.2.0",
  "sessionId": "aborted",
  "startTime": "2026-08-24T14:00:00-04:00",
  "exercises": [
    {
      "exerciseId": "Deadlift",
      "order": 1,
      "sets": [
        {
          "setNumber": 1,
          "setType": "working",
          "reps": 2,
          "load": {
            "value": 150,
            "unit": "kg"
          },
          "completed": false,
          "notes": "Stopped due to grip"
        }
      ]
    }
  ]
}
