{
  "schemaVersion": "0.2.0",
  "sessionId": "bodyweight",
  "startTime": "2026-08-24T14:00:00-04:00",
  "exercises": [
    {
      "exerciseId": "Pullups",
      "order": 1,
      "sets": [
        {
          "setNumber": 1,
          "setType": "working",
          "reps": 8,
          "resistance": {
            "mode": "bodyweight"
          },
          "completed": true
        }
      ]
    }
  ]
}
