{
  "schemaVersion": "0.2.0",
  "sessionId": "custom",
  "startTime": "2026-08-24T14:00:00-04:00",
  "exercises": [
    {
      "exerciseId": null,
      "order": 1,
      "sets": [
        {
          "setNumber": 1,
          "setType": "working",
          "reps": 12,
          "load": {
            "value": 20,
            "unit": "kg"
          },
          "completed": true
        }
      ],
      "exerciseName": "Custom Cable Press",
      "externalExerciseId": {
        "system": "com.example.trainingapp",
        "value": "exercise-998"
      }
    }
  ]
}
