{
  "schemaVersion": "0.2.0",
  "sessionId": "amrap",
  "startTime": "2026-08-24T14:00:00-04:00",
  "exercises": [
    {
      "exerciseId": "Pushups",
      "order": 1,
      "sets": [
        {
          "setNumber": 1,
          "setType": "amrap",
          "reps": 23,
          "toFailure": true,
          "completed": true
        }
      ]
    }
  ]
}
