{
  "schemaVersion": "0.2.0",
  "sessionId": "timed-isometric",
  "startTime": "2026-08-24T14:00:00-04:00",
  "exercises": [
    {
      "exerciseId": "Plank",
      "order": 1,
      "sets": [
        {
          "setNumber": 1,
          "setType": "isometric",
          "duration": {
            "value": 45,
            "unit": "s"
          },
          "completed": true
        }
      ]
    }
  ]
}
