{
  "schemaVersion": "0.2.0",
  "sessionId": "alternating",
  "startTime": "2026-08-24T14:00:00-04:00",
  "exercises": [
    {
      "exerciseId": "Dumbbell_Lunge",
      "order": 1,
      "sets": [
        {
          "setNumber": 1,
          "setType": "working",
          "laterality": "alternating",
          "reps": 12,
          "load": {
            "value": 16,
            "unit": "kg"
          },
          "completed": true
        }
      ],
      "laterality": "alternating"
    }
  ]
}
